{
  "type": "object",
  "additionalProperties": false,
  "required": [
    "schema",
    "profile",
    "id",
    "name",
    "version",
    "license",
    "core",
    "runtime",
    "permissions",
    "network",
    "events",
    "secrets",
    "data",
    "ui",
    "offline"
  ],
  "properties": {
    "schema": {
      "type": "integer",
      "const": 1
    },
    "profile": {
      "type": "string",
      "const": "ocwp.module-descriptor.m0"
    },
    "id": {
      "type": "string",
      "minLength": 5,
      "maxLength": 128,
      "pattern": "^[a-z][a-z0-9]*(?:\\.[a-z][a-z0-9-]*){2,}$"
    },
    "name": {
      "type": "string",
      "minLength": 1,
      "maxLength": 80
    },
    "version": {
      "type": "string",
      "const": "0.0.0-m0"
    },
    "license": {
      "type": "string",
      "const": "AGPL-3.0-only"
    },
    "core": {
      "type": "object",
      "additionalProperties": false,
      "required": ["requires"],
      "properties": {
        "requires": {
          "type": "string",
          "const": "ocwp-source:a960bddb94189c6c74c7f3d0a72472636c3caced"
        }
      }
    },
    "runtime": {
      "type": "object",
      "additionalProperties": false,
      "required": ["type"],
      "properties": {
        "type": {
          "type": "string",
          "enum": ["official-build", "external-connector"]
        }
      }
    },
    "permissions": {
      "type": "array",
      "maxItems": 0,
      "items": false
    },
    "network": {
      "type": "object",
      "additionalProperties": false,
      "required": ["hosts"],
      "properties": {
        "hosts": {
          "type": "array",
          "maxItems": 0,
          "items": false
        }
      }
    },
    "events": {
      "type": "object",
      "additionalProperties": false,
      "required": ["subscribes"],
      "properties": {
        "subscribes": {
          "type": "array",
          "maxItems": 0,
          "items": false
        }
      }
    },
    "secrets": {
      "type": "array",
      "maxItems": 0,
      "items": false
    },
    "data": {
      "type": "object",
      "additionalProperties": false,
      "required": ["owns"],
      "properties": {
        "owns": {
          "type": "array",
          "maxItems": 0,
          "items": false
        }
      }
    },
    "ui": {
      "type": "object",
      "additionalProperties": false,
      "required": ["slots"],
      "properties": {
        "slots": {
          "type": "array",
          "maxItems": 0,
          "items": false
        }
      }
    },
    "offline": {
      "type": "object",
      "additionalProperties": false,
      "required": ["mode"],
      "properties": {
        "mode": {
          "type": "string",
          "const": "online-only"
        }
      }
    }
  },
  "$schema": "https://json-schema.org/draft/2020-12/schema",
  "title": "OCWP inert module proposal descriptor M0 (not runtime validation)"
}
